{
  "id": "2026-08-08-kijai-lightx2v-4step",
  "date": "2026-08-08",
  "status": "verified",
  "hypothesis": "KijaiのLightX2V 4-step LoRAをMiniMax-H3公式VAEとpruned int8 baseへ接続すると、4 stepsで動画生成できる。",
  "sources": [
    {
      "type": "huggingface",
      "url": "https://huggingface.co/Kijai/MiniMax-H3_comfy",
      "revision": "37ae5cbe1d6f2243484812fc511f9fa427b12a30",
      "checkedAt": "2026-08-08",
      "facts": ["4 steps", "LoRA strength 0.75", "er_sde", "sa_solver"]
    },
    {
      "type": "x",
      "url": "https://x.com/sd_tutorial/status/2085760369612783646",
      "checkedAt": "2026-08-08",
      "facts": ["Kijai repacked LightX2V H3 turbo LoRA for Comfy support", "video 1344x768", "duration 6.583 seconds", "public MP4 variant 158 frames at 24 fps", "ffprobe duration 6.656 seconds"]
    },
    {
      "type": "huggingface-upstream",
      "url": "https://huggingface.co/lightx2v/Minimax-h3-Turbo/tree/main",
      "revision": "b65e359c0d128b3c5e08e0f5bf2791b794378588",
      "checkedAt": "2026-08-08",
      "facts": ["base LightX2V H3 turbo safetensors", "ModelTC/Minimax-H3-Turbo reproduction link"]
    }
  ],
  "conditions": {
    "gpu": "RTX 4090",
    "composeService": "h3-4090",
    "baseModel": "minimax_h3_fl2va_pruned_int8_convrot.safetensors",
    "textEncoder": "qwen3vl_32b_minimax_h3_nvfp4_awq.safetensors",
    "videoVae": "minimax_h3_video_vae_fp16.safetensors",
    "audioVae": "minimax_h3_audio_vae_fp32.safetensors",
    "lora": "minimax_h3_fl2v_lightx2v_turbo_4step_v0.1_comfy.safetensors",
    "loraStrength": 0.75,
    "steps": 4,
    "resolution": "1344x768",
    "frames": 158,
    "fps": 24,
    "sampler": ["er_sde", "sa_solver"],
    "scheduler": "simple",
    "sourceVideoDurationSeconds": 6.583,
    "sourceVideoFfprobeFrames": 158,
    "sourceVideoFfprobeDurationSeconds": 6.656,
    "modes": ["T2V", "I2V"],
    "i2vInput": {
      "path": "runtime/4090/input/MiniMax_H3_I2V_1344x768_start.png",
      "width": 1344,
      "height": 768,
      "sha256": "9E5893D7C5A9919726E7E60FF2BF4F19E77F746342D38E5FE3217FD2288A3D0F",
      "derivedFrom": "runtime/4090/input/MiniMax_H3_I2V_1280x704_start.png",
      "transformation": "scale with original-aspect increase, center crop, Lanczos to 1344x768"
    }
  },
  "runs": [
    {
      "id": "t2v-er_sde",
      "mode": "T2V",
      "sampler": "er_sde",
      "seed": 2026080801,
      "promptId": "b87755af-c053-42c3-8c49-6c628013b124",
      "status": "success",
      "startedLocal": "2026-08-08T10:53:36.6455177+09:00",
      "endedLocal": "2026-08-08T10:59:42.3559757+09:00",
      "inferenceSeconds": 362.48,
      "wallSeconds": 365.71,
      "workflow": "workflows/minimax_h3_kijai_lightx2v_4step_1344x768_er_sde_api.json",
      "workflowSha256": "C7680D1756F710D114219E819303295055EEC10ABF39AD52D1920CC3617C4B42",
      "reportJson": "runtime/4090/benchmark/h3-b87755af-c053-42c3-8c49-6c628013b124.json",
      "reportMarkdown": "runtime/4090/benchmark/h3-b87755af-c053-42c3-8c49-6c628013b124.md",
      "output": "runtime/4090/output/video/MiniMax_H3_Kijai_LightX2V_T2V_1344x768_4step_er_sde_00001_.mp4",
      "outputBytes": 4604012,
      "outputSha256": "B0540FE30DC549ABA6E14B3A36270BFE7068CC76F81B2763C0949CEDD92E233E",
      "media": {
        "resolution": "1344x768",
        "frames": 158,
        "fps": 24,
        "durationSeconds": 6.583333,
        "audio": "AAC stereo 32000Hz, 6.575000 seconds",
        "blackdetectIntervals": 0,
        "visualInspection": "first and middle frames show a valid sunrise lake, mountain, mist, and foliage shot"
      }
    },
    {
      "id": "t2v-sa_solver",
      "mode": "T2V",
      "sampler": "sa_solver",
      "seed": 2026080801,
      "promptId": "405a78d2-9999-42b7-ab3b-759771760416",
      "status": "success",
      "startedLocal": "2026-08-08T11:00:52.3601106+09:00",
      "endedLocal": "2026-08-08T11:04:12.7503089+09:00",
      "inferenceSeconds": 196.25,
      "wallSeconds": 200.39,
      "workflow": "workflows/minimax_h3_kijai_lightx2v_4step_1344x768_sa_solver_api.json",
      "workflowSha256": "5AE470B6EB816C4FFC71C74FD435549B3C4F8B74C8BA868CCC0E87463D63FC7C",
      "reportJson": "runtime/4090/benchmark/h3-405a78d2-9999-42b7-ab3b-759771760416.json",
      "reportMarkdown": "runtime/4090/benchmark/h3-405a78d2-9999-42b7-ab3b-759771760416.md",
      "output": "runtime/4090/output/video/MiniMax_H3_Kijai_LightX2V_T2V_1344x768_4step_sa_solver_00001_.mp4",
      "outputBytes": 4823136,
      "outputSha256": "DFB59D2BF85A1AFDAEB4C8B3EFABDD2909E91EBD46991F2DB7933F8B96C2C682",
      "media": {
        "resolution": "1344x768",
        "frames": 158,
        "fps": 24,
        "durationSeconds": 6.583333,
        "audio": "AAC stereo 32000Hz, 6.575000 seconds",
        "blackdetectIntervals": 0,
        "visualInspection": "first and middle frames show a valid sunrise lake, mountain, mist, and foliage shot"
      }
    },
    {
      "id": "i2v-er_sde",
      "mode": "I2V",
      "sampler": "er_sde",
      "seed": 2026080802,
      "promptId": "0734b9d9-105b-47b3-a562-ba4bb8e2f3b5",
      "status": "success",
      "startedLocal": "2026-08-08T11:08:40.0057252+09:00",
      "endedLocal": "2026-08-08T11:12:10.4624677+09:00",
      "inferenceSeconds": 210.05,
      "wallSeconds": 210.457,
      "workflow": "workflows/minimax_h3_kijai_lightx2v_4step_1344x768_i2v_er_sde_api.json",
      "workflowSha256": "6BD295F8EFE7D643D8D4794284955A164C73D98E3996675509102830CE59C397",
      "reportJson": "runtime/4090/benchmark/h3-0734b9d9-105b-47b3-a562-ba4bb8e2f3b5.json",
      "reportMarkdown": "runtime/4090/benchmark/h3-0734b9d9-105b-47b3-a562-ba4bb8e2f3b5.md",
      "output": "runtime/4090/output/video/MiniMax_H3_Kijai_LightX2V_I2V_1344x768_4step_er_sde_00001_.mp4",
      "outputBytes": 1817050,
      "outputSha256": "CB7A683AF4A9864CA6A1EDAB1C3F350019FF88E9329E12823601772E03791787",
      "inputImage": "runtime/4090/input/MiniMax_H3_I2V_1344x768_start.png",
      "media": {
        "resolution": "1344x768",
        "frames": 158,
        "fps": 24,
        "durationSeconds": 6.583333,
        "audio": "AAC stereo 32000Hz, 6.575000 seconds",
        "blackdetectIntervals": 0,
        "visualInspection": "first and middle frames show a valid I2V sunrise lake shot with mist and reflection"
      }
    },
    {
      "id": "i2v-sa_solver",
      "mode": "I2V",
      "sampler": "sa_solver",
      "seed": 2026080802,
      "promptId": "c56359c6-d7ca-4a64-bc30-b8add8ce5c7d",
      "status": "success",
      "startedLocal": "2026-08-08T11:12:58.4777124+09:00",
      "endedLocal": "2026-08-08T11:16:13.8949292+09:00",
      "inferenceSeconds": 193.72,
      "wallSeconds": 195.417,
      "workflow": "workflows/minimax_h3_kijai_lightx2v_4step_1344x768_i2v_sa_solver_api.json",
      "workflowSha256": "2B8AF00CB840E6E777D4B79D3B2501C81DF340BDAD672CD5AF976A959D56AA09",
      "reportJson": "runtime/4090/benchmark/h3-c56359c6-d7ca-4a64-bc30-b8add8ce5c7d.json",
      "reportMarkdown": "runtime/4090/benchmark/h3-c56359c6-d7ca-4a64-bc30-b8add8ce5c7d.md",
      "output": "runtime/4090/output/video/MiniMax_H3_Kijai_LightX2V_I2V_1344x768_4step_sa_solver_00001_.mp4",
      "outputBytes": 1834299,
      "outputSha256": "EB6487E54E1C8412A8BAAD2628CB25D24238E901B8939C8BF502B95C4E5F17B6",
      "inputImage": "runtime/4090/input/MiniMax_H3_I2V_1344x768_start.png",
      "media": {
        "resolution": "1344x768",
        "frames": 158,
        "fps": 24,
        "durationSeconds": 6.583333,
        "audio": "AAC stereo 32000Hz, 6.575000 seconds",
        "blackdetectIntervals": 0,
        "visualInspection": "first and middle frames show a valid I2V sunrise lake shot with mist and reflection"
      }
    }
  ],
  "artifacts": [
    {
      "type": "model",
      "path": "models/loras/minimax_h3_fl2v_lightx2v_turbo_4step_v0.1_comfy.safetensors",
      "bytes": 1956171984,
      "sha256": "FC9B6500F0331FE925B004738BAAA31BD34104741C8BF9334816F9AC3005C8C1"
    },
    {
      "type": "input-image",
      "path": "runtime/4090/input/MiniMax_H3_I2V_1344x768_start.png",
      "bytes": 1187835,
      "sha256": "9E5893D7C5A9919726E7E60FF2BF4F19E77F746342D38E5FE3217FD2288A3D0F"
    }
  ],
  "conclusion": "KijaiのMiniMax-H3向けLightX2V LoRAを既存Docker Compose環境へmodel-onlyで接続し、LoRA strength 0.75・4 steps・1344x768・158 framesでT2VとI2Vの双方を実行できた。4 runすべてsuccess、OOMなし、blackdetect interval 0、音声付きH.264/AAC出力だった。同一条件ではsa_solverがer_sdeより速かったが、X投稿にないGPU、prompt、seed、scheduler、workflow差が残るため、X動画の完全再現ではなく出典条件への部分一致と結論づける。",
  "limitations": [
    "X投稿にGPU、seed、prompt、sampler、schedulerは記載されていない",
    "Kijai READMEはLoRA alphaの意図値を確定していない",
    "X動画の1344x768と6.583秒は公開メタデータであり、生成workflowの完全条件ではない",
    "I2V入力は既存の1280x704開始フレームを1344x768へcrop/resizeしたローカル派生画像で、X投稿の入力画像ではない",
    "画質のsampler優劣は目視確認に留まり、定量的な動画品質評価は未実施"
  ]
}
